{
  "$schema": "https://json-schema.org/draft/2020-12/schema",
  "title": "Audit Report",
  "type": "object",
  "required": ["id", "period_start", "period_end", "summary"],
  "properties": {
    "id": { "type": "string", "minLength": 1 },
    "period_start": { "type": "string", "minLength": 1 },
    "period_end": { "type": "string", "minLength": 1 },
    "summary": { "type": "string", "minLength": 1 },
    "findings": {
      "type": "array",
      "items": { "$ref": "#/$defs/finding" }
    },
    "lessons": { "type": "array", "items": { "type": "string" } },
    "actions": { "type": "array", "items": { "type": "string" } },
    "metadata": { "type": "object", "additionalProperties": true }
  },
  "additionalProperties": false,
  "$defs": {
    "finding": {
      "type": "object",
      "required": ["id", "finding"],
      "properties": {
        "id": { "type": "string", "minLength": 1 },
        "finding": { "type": "string", "minLength": 1 },
        "evidence": { "type": "array", "items": { "type": "string" } },
        "impact": { "type": "string" },
        "recommendations": { "type": "array", "items": { "type": "string" } }
      },
      "additionalProperties": false
    }
  }
}
